<!ELEMENT scalar (#PCDATA)>
<!ELEMENT scalarref (#PCDATA)>
<!ATTLIST scalarref 
	blessed_package CDATA #IMPLIED
 	memory_address CDATA #IMPLIED>
<!ELEMENT arrayref (item*)>
<!ATTLIST arrayref 
	blessed_package CDATA #IMPLIED
 	memory_address CDATA #IMPLIED>
<!ELEMENT hashref (item*)>
<!ATTLIST hashref 
	blessed_package CDATA #IMPLIED
 	memory_address CDATA #IMPLIED>
<!ELEMENT item (#PCDATA|scalar|scalarref|arrayref|hashref)*>
<!ATTLIST item 
	key CDATA #REQUIRED
	defined CDATA #IMPLIED>
<!ELEMENT perldata (scalar|scalarref|arrayref|hashref)*>
